{
  "window": "all",
  "agent": "",
  "generated_at": "TIMESTAMP",
  "metrics": {
    "turn_duration": [],
    "blocker_accumulation": [],
    "agent_completion": [],
    "agent_blocker_freq": [],
    "evidence_bound_decisions": {
      "ratio": 0,
      "linked_count": 0,
      "total_count": 0
    }
  }
}
